{
  "schema_version": "industry-underwriting-context.v1",
  "context_id": "IUC:CN:CEMENT_LISTED:CN600585:20180430:REPLAY:V1",
  "company_identity": {
    "company_id": "CN:600585",
    "company_name": "Anhui Conch Cement",
    "cutoff_at": "2018-04-30T23:59:59+08:00",
    "industry_ids": [
      "INDUSTRY:CN:CEMENT_LISTED",
      "cement"
    ]
  },
  "context_status": "BOUNDED",
  "report_use": {
    "mode": "REPORT_PREPARATION_READ_MODEL",
    "non_blocking": true,
    "can_support": [
      "INDUSTRY_RESEARCH_AGENDA",
      "CANDIDATE_INDUSTRY_FUTURE_THESIS",
      "PEER_AND_NEAR_MISS_SELECTION"
    ],
    "cannot_establish": [
      "COMPANY_FACT_WITHOUT_COMPANY_EVIDENCE",
      "VALUATION_PARAMETER",
      "INVESTMENT_ACTION"
    ],
    "boundary": "A BOUNDED context remains usable. The report must make and source its own best-current industry and company judgment."
  },
  "industry_value_chain": {
    "stages": [
      {
        "arena_id": "ARENA:CN:CEMENT:MULTI_REGION_DELIVERED_MARKET",
        "mechanism": "UNRESOLVED_FROM_AVAILABLE_CONTEXT",
        "economic_scope": "UNRESOLVED_FROM_AVAILABLE_CONTEXT",
        "customer_job_or_choice": "UNRESOLVED_FROM_AVAILABLE_CONTEXT",
        "value_driver": "UNRESOLVED_FROM_AVAILABLE_CONTEXT",
        "failure_mode": "UNRESOLVED_FROM_AVAILABLE_CONTEXT",
        "profit_pool_direction": "UNRESOLVED",
        "evidence_refs": [],
        "source_object_ref": "docs/development/research/industry_learning_blocks/CN_CEMENT_2014_2018/04_industry_learning_block.json"
      },
      {
        "arena_id": "ARENA:CN:CEMENT:MULTI_REGION_DELIVERED_MARKET",
        "mechanism": "A change in the reporting perimeter may alter the composition of a reported operating or cash series.",
        "economic_scope": "A listed-consolidated cement issuer discloses an acquisition, restructuring or joint-venture perimeter condition.",
        "customer_job_or_choice": "UNRESOLVED_FROM_AVAILABLE_CONTEXT",
        "value_driver": "A perimeter-continuity question attached to the affected issuer and cutoff.",
        "failure_mode": "A cutoff-visible bridge establishes the same responsibility boundary and field definition.",
        "profit_pool_direction": "UNRESOLVED",
        "evidence_refs": [
          "CNINFO:600801:ANN:20170324:1203190337",
          "CNINFO:000401:ANN:20180323:1204506085"
        ],
        "source_object_ref": "docs/development/research/industry_learning_blocks/CN_CEMENT_2014_2018/04_industry_learning_block.json"
      },
      {
        "arena_id": "ARENA:CN:CEMENT:MULTI_REGION_DELIVERED_MARKET",
        "mechanism": "The statements can support a bounded operating-to-cash reconstruction at the same issuer perimeter.",
        "economic_scope": "Issuer-consolidated product, sales and audited cash fields are all cutoff-visible.",
        "customer_job_or_choice": "UNRESOLVED_FROM_AVAILABLE_CONTEXT",
        "value_driver": "An accounting-boundary learning thread rather than owner-cash, competitive advantage or causal effect.",
        "failure_mode": "A material perimeter, accounting or working-capital change makes the selected field non-diagnostic.",
        "profit_pool_direction": "UNRESOLVED",
        "evidence_refs": [
          "CNINFO:600585:ANN:20170324:1203189438",
          "CNINFO:600425:ANN:20180421:1204677754"
        ],
        "source_object_ref": "docs/development/research/industry_learning_blocks/CN_CEMENT_2014_2018/04_industry_learning_block.json"
      },
      {
        "arena_id": "ARENA:CN:CEMENT:MULTI_REGION_DELIVERED_MARKET",
        "mechanism": "Cement and clinker supplied through issuer-consolidated production and distribution assets; product and customer response are evaluated within the relevant delivered market rather than by issuer province labels. -> Construction, infrastructure and property customers served through regional cement/clinker channels; action-specific transport radius, delivered-price and customer overlap are reserved for H2.",
        "economic_scope": "MULTI_REGION_PORTFOLIO",
        "customer_job_or_choice": "Construction, infrastructure and property customers served through regional cement/clinker channels; action-specific transport radius, delivered-price and customer overlap are reserved for H2.",
        "value_driver": "UNRESOLVED_FROM_AVAILABLE_CONTEXT",
        "failure_mode": "UNRESOLVED_FROM_AVAILABLE_CONTEXT",
        "profit_pool_direction": "UNRESOLVED",
        "evidence_refs": [
          "CNINFO:600425:ANN:20180421:1204677754",
          "CNINFO:600802:ANN:20180417:1204639756"
        ],
        "source_object_ref": "INLINE:COMPANY_COMPETITIVE_ARENA"
      }
    ],
    "customer_jobs": [
      "Construction, infrastructure and property customers served through regional cement/clinker channels; action-specific transport radius, delivered-price and customer overlap are reserved for H2."
    ]
  },
  "structural_epochs": [
    {
      "epoch_id": "EPOCH:CEMENT:2014",
      "as_of": "2014-04-16T00:00:00+08:00",
      "condition": "The H1 risk set contains five listed-consolidated cement issuers with date-only official annual-report material visible before the cutoff.",
      "observations": [],
      "evidence_refs": [
        "CNINFO:600585:ANN:20140325:63719331"
      ],
      "source_object_ref": "docs/development/research/industry_learning_blocks/CN_CEMENT_2014_2018/04_industry_learning_block.json"
    },
    {
      "epoch_id": "EPOCH:CEMENT:2015",
      "as_of": "2015-04-15T00:00:00+08:00",
      "condition": "The same five issuer identifiers remain in the H1 static risk set; this is a source-coverage state rather than a survival conclusion.",
      "observations": [],
      "evidence_refs": [
        "CNINFO:600585:ANN:20150324:1200733224"
      ],
      "source_object_ref": "docs/development/research/industry_learning_blocks/CN_CEMENT_2014_2018/04_industry_learning_block.json"
    },
    {
      "epoch_id": "EPOCH:CEMENT:2016",
      "as_of": "2016-04-27T00:00:00+08:00",
      "condition": "The H1 static risk set continues to preserve all five issuer-consolidated boundaries before any later outcome access.",
      "observations": [],
      "evidence_refs": [
        "CNINFO:600585:ANN:20160324:1202069257"
      ],
      "source_object_ref": "docs/development/research/industry_learning_blocks/CN_CEMENT_2014_2018/04_industry_learning_block.json"
    },
    {
      "epoch_id": "EPOCH:CEMENT:2017",
      "as_of": "2017-04-12T00:00:00+08:00",
      "condition": "A disclosed 15-plant acquisition approval makes Huaxin perimeter continuity an explicit measurement question while retaining it in the risk set.",
      "observations": [],
      "evidence_refs": [
        "CNINFO:600801:ANN:20170324:1203190337"
      ],
      "source_object_ref": "docs/development/research/industry_learning_blocks/CN_CEMENT_2014_2018/04_industry_learning_block.json"
    },
    {
      "epoch_id": "EPOCH:CEMENT:2018:ANNUAL",
      "as_of": "2018-04-22T00:00:00+08:00",
      "condition": "The five H1 issuers remain in the static risk set, with Jidong restructuring and Huaxin perimeter continuity retained as lifecycle boundaries rather than removed observations.",
      "observations": [],
      "evidence_refs": [
        "CNINFO:000401:ANN:20180323:1204506085"
      ],
      "source_object_ref": "docs/development/research/industry_learning_blocks/CN_CEMENT_2014_2018/04_industry_learning_block.json"
    },
    {
      "epoch_id": "EPOCH:CEMENT:2018:SELECTION",
      "as_of": "2018-04-30T23:59:59+08:00",
      "condition": "This is a selection refresh using the same H1 disclosure epoch; it is not a new operating outcome window.",
      "observations": [],
      "evidence_refs": [
        "CNINFO:600425:ANN:20180421:1204677754"
      ],
      "source_object_ref": "docs/development/research/industry_learning_blocks/CN_CEMENT_2014_2018/04_industry_learning_block.json"
    }
  ],
  "industry_drivers": {
    "demand": [
      {
        "driver": "Cement and clinker supplied through issuer-consolidated production and distribution assets; product and customer response are evaluated within the relevant delivered market rather than by issuer province labels. -> Construction, infrastructure and property customers served through regional cement/clinker channels; action-specific transport radius, delivered-price and customer overlap are reserved for H2. UNRESOLVED_FROM_AVAILABLE_CONTEXT UNRESOLVED_FROM_AVAILABLE_CONTEXT",
        "profit_pool_effect": "UNRESOLVED",
        "evidence_refs": [
          "CNINFO:600425:ANN:20180421:1204677754",
          "CNINFO:600802:ANN:20180417:1204639756"
        ],
        "source_object_ref": "INLINE:COMPANY_COMPETITIVE_ARENA"
      }
    ],
    "supply": [],
    "competition": [
      {
        "driver": "Cement and clinker supplied through issuer-consolidated production and distribution assets; product and customer response are evaluated within the relevant delivered market rather than by issuer province labels. -> Construction, infrastructure and property customers served through regional cement/clinker channels; action-specific transport radius, delivered-price and customer overlap are reserved for H2. UNRESOLVED_FROM_AVAILABLE_CONTEXT UNRESOLVED_FROM_AVAILABLE_CONTEXT",
        "profit_pool_effect": "UNRESOLVED",
        "evidence_refs": [
          "CNINFO:600425:ANN:20180421:1204677754",
          "CNINFO:600802:ANN:20180417:1204639756"
        ],
        "source_object_ref": "INLINE:COMPANY_COMPETITIVE_ARENA"
      }
    ],
    "regulation": []
  },
  "profit_pool_outlook": {
    "direction": "UNRESOLVED",
    "horizon": "NOT_SPECIFIED",
    "thesis": "The available context identifies the relevant mechanisms but does not yet settle a directional profit-pool call.",
    "confidence": "BOUNDED",
    "evidence_refs": [
      "CNINFO:600801:ANN:20170324:1203190337",
      "CNINFO:000401:ANN:20180323:1204506085",
      "CNINFO:600585:ANN:20170324:1203189438",